{
  "archetype_id": "edhtop16-raffine_scheming_seer",
  "commanders": [
    "Raffine, Scheming Seer"
  ],
  "strategic_architecture": "NOT YET CLASSIFIED (Phase 8 pending) - this record represents a commander pairing as reported by EDHTop16, not a strategy-clustered archetype. The same commander(s) may span multiple materially different architectures; conversely this pairing should not be assumed to be a single coherent strategy until a primer/recent-decklist review is done.",
  "split_from": null,
  "prevalence": {
    "tournament_window": "edhtop16-ONE_YEAR-pulled-2026-08-12",
    "entry_count": 35,
    "total_entries_in_window": 41746,
    "source": "edhtop16"
  },
  "representative_lists": [
    {
      "source": "edhtop16",
      "reference": "https://edhtop16.com/commander/Q29tbWFuZGVyOjIzNg==",
      "date": "edhtop16-ONE_YEAR-pulled-2026-08-12",
      "notable_variance": "No individual decklist links returned by EDHTop16 for this commander in this pull; representative_lists points at the commander's aggregate EDHTop16 page instead."
    }
  ],
  "policy_ref": null,
  "confidence_tier": "low_frequency_shallow_model",
  "registry_version": "archetypes-2025-08-12_2026-08-12"
}
