{
  "archetype_id": "edhtop16-tivit_seller_of_secrets",
  "commanders": [
    "Tivit, Seller of Secrets"
  ],
  "strategic_architecture": "NOT YET CLASSIFIED (Phase 8 pending) - this record represents a commander pairing as reported by EDHTop16, not a strategy-clustered archetype. The same commander(s) may span multiple materially different architectures; conversely this pairing should not be assumed to be a single coherent strategy until a primer/recent-decklist review is done.",
  "split_from": null,
  "prevalence": {
    "tournament_window": "edhtop16-ONE_YEAR-pulled-2026-08-12",
    "entry_count": 673,
    "total_entries_in_window": 41746,
    "source": "edhtop16"
  },
  "representative_lists": [
    {
      "source": "edhtop16",
      "reference": "https://topdeck.gg/deck/manamaster-november-2025/e5wXEeT38VfVUvbWSjHUceEtz3k2",
      "date": "2025-11-08T15:45:00.000Z",
      "notable_variance": "Standing 1 of tournament 'Manamaster November 2025' (size 98); record 4-2-1."
    },
    {
      "source": "edhtop16",
      "reference": "https://topdeck.gg/deck/the-boil-beignets-beatdowns-redemption-event/YtsQRowNkORkQR3N68DNMAJen0u1",
      "date": "2026-03-29T18:50:00.000Z",
      "notable_variance": "Standing 1 of tournament 'The Boil - Beignets & Beatdowns Redemption Event' (size 91); record 2-0-1."
    },
    {
      "source": "edhtop16",
      "reference": "https://topdeck.gg/deck/shamrock-showdown-2/hOD7uJZohvb4CuPc656PKoIk4wH2",
      "date": "2026-03-15T16:00:00.000Z",
      "notable_variance": "Standing 1 of tournament 'Shamrock Showdown 2' (size 78); record 4-0-3."
    }
  ],
  "policy_ref": null,
  "confidence_tier": "high_frequency_deep_model",
  "registry_version": "archetypes-2025-08-12_2026-08-12"
}
