{
  "archetype_id": "edhtop16-dargo_the_shipwrecker_tymna_the_weaver",
  "commanders": [
    "Dargo, the Shipwrecker",
    "Tymna the Weaver"
  ],
  "strategic_architecture": "NOT YET CLASSIFIED (Phase 8 pending) - this record represents a commander pairing as reported by EDHTop16, not a strategy-clustered archetype. The same commander(s) may span multiple materially different architectures; conversely this pairing should not be assumed to be a single coherent strategy until a primer/recent-decklist review is done.",
  "split_from": null,
  "prevalence": {
    "tournament_window": "edhtop16-SIX_MONTHS-pulled-2026-08-12",
    "entry_count": 636,
    "total_entries_in_window": 23281,
    "source": "edhtop16"
  },
  "representative_lists": [
    {
      "source": "edhtop16",
      "reference": "https://topdeck.gg/deck/the-fishbowl-san-diego-copy/SYqVM7LGlUOj6h3iLii86ALqDeH3",
      "date": "2025-10-25T16:00:00.000Z",
      "notable_variance": "Standing 1 of tournament 'The Fishbowl 6' (size 295); record 6-1-2."
    },
    {
      "source": "edhtop16",
      "reference": "https://topdeck.gg/deck/breach-the-bay-cedh-10k/0WfTxi3Vtvhb6iwVF4f8DpDbhzN2",
      "date": "2026-01-24T16:00:00.000Z",
      "notable_variance": "Standing 1 of tournament 'BREACH THE BAY - cEDH 10K' (size 183); record 4-0-3."
    },
    {
      "source": "edhtop16",
      "reference": "https://topdeck.gg/deck/mbg-august-8th-mox-diamond-event/eRh1ZtCgV6NX6GDyneoSA7BCUmz1",
      "date": "2026-08-08T16:00:00.000Z",
      "notable_variance": "Standing 1 of tournament 'MBG August 8th Mox Diamond Event' (size 61); record 4-1-2."
    }
  ],
  "policy_ref": null,
  "confidence_tier": "high_frequency_deep_model",
  "registry_version": "archetypes-2026-02-12_2026-08-12"
}
