{
  "archetype_id": "edhtop16-magda_brazen_outlaw",
  "commanders": [
    "Magda, Brazen Outlaw"
  ],
  "strategic_architecture": "NOT YET CLASSIFIED (Phase 8 pending) - this record represents a commander pairing as reported by EDHTop16, not a strategy-clustered archetype. The same commander(s) may span multiple materially different architectures; conversely this pairing should not be assumed to be a single coherent strategy until a primer/recent-decklist review is done.",
  "split_from": null,
  "prevalence": {
    "tournament_window": "edhtop16-ONE_YEAR-pulled-2026-08-12",
    "entry_count": 958,
    "total_entries_in_window": 41746,
    "source": "edhtop16"
  },
  "representative_lists": [
    {
      "source": "edhtop16",
      "reference": "https://topdeck.gg/deck/mulligans-championship-series-january/oQYF7Qdfq0atPPZx4P7S0if41Uc2",
      "date": "2026-01-04T15:00:00.000Z",
      "notable_variance": "Standing 1 of tournament 'Mulligan's Championship Series - January w/ Guaranteed Tundra' (size 73); record 4-2-1."
    },
    {
      "source": "edhtop16",
      "reference": "https://topdeck.gg/deck/bonfire-3-red-white-bluefarm/qujVfPt8DvYuYAUFqthXwNCcgqu1",
      "date": "2026-07-18T15:00:00.000Z",
      "notable_variance": "Standing 1 of tournament 'Bonfire 3: Red, White, & Bluefarm 1K ' (size 70); record 6-1-0."
    },
    {
      "source": "edhtop16",
      "reference": "https://topdeck.gg/deck/nautilus-games-grand-opening-charity-event/pGlfATLpojSPeH4fobUrGnzMeY22",
      "date": "2026-04-04T16:00:00.000Z",
      "notable_variance": "Standing 1 of tournament 'Nautilus Games cEDH Charity Food Drive' (size 55); record 4-2-0."
    }
  ],
  "policy_ref": null,
  "confidence_tier": "high_frequency_deep_model",
  "registry_version": "archetypes-2025-08-12_2026-08-12"
}
