{
  "archetype_id": "edhtop16-vivi_ornitier",
  "commanders": [
    "Vivi Ornitier"
  ],
  "strategic_architecture": "Solo-commander Izzet (U/R) spellslinger storm/combo archetype, distinct from the creature-centric or toolbox archetypes above. Vivi grows with every noncreature spell cast and converts its power into mana; typical game plan chains cheap noncreature spells into card draw (Curiosity-effects on Vivi) toward Underworld Breach/Brain Freeze mill loops or direct combo kills, protected by a dense free-counterspell suite. Sources: Draftsim 'Vivi Ornitier Commander Deck Guide', Cards Realm 'cEDH Deck Tech: Vivi Ornitier'.",
  "split_from": null,
  "prevalence": {
    "tournament_window": "edhtop16-ONE_YEAR-pulled-2026-08-12",
    "entry_count": 941,
    "total_entries_in_window": 41746,
    "source": "edhtop16"
  },
  "representative_lists": [
    {
      "source": "edhtop16",
      "reference": "https://topdeck.gg/deck/cosmic-crown-championship-central-coast-california-league/niTqlfoXcbaPpxruhI0HMlku79f1",
      "date": "2026-01-17T19:00:00.000Z",
      "notable_variance": "Standing 1 of tournament '$10k Cosmic Crown Championship (Central Coast California League Open)' (size 118); record 6-0-1."
    },
    {
      "source": "edhtop16",
      "reference": "https://topdeck.gg/deck/the-bonefire-2-magic-may-hem/f9fY4V4MyMMe2vkN6KYxjpPRrvd2",
      "date": "2026-05-16T16:30:00.000Z",
      "notable_variance": "Standing 1 of tournament 'The Bonfire 2: Magic May-hem' (size 59); record 4-1-2."
    },
    {
      "source": "edhtop16",
      "reference": "https://topdeck.gg/deck/april-up-in-smoke-cedh-tournament/aq61gCRnzKb2YNjsxE82u5LVJKW2",
      "date": "2026-04-11T15:00:00.000Z",
      "notable_variance": "Standing 1 of tournament 'April UP IN SMOKE Cedh Tournament' (size 56); record 4-1-2."
    }
  ],
  "policy_ref": null,
  "confidence_tier": "high_frequency_deep_model",
  "registry_version": "archetypes-2025-08-12_2026-08-12"
}
